sentences,Neutral,OverconfidenceBias,ConfirmationBias,AnchoringBias,FramingBias,OccasionNoise
"Despite hearing from several experts that her town has very low crime rates, Sarah still firmly believes it's an unsafe place to live in, basing her belief on that one news story she read years ago about a single burglary incident.",0,0,1,1,0,0
"Even though I saw more impressive resumes later, I can't help but favor the first candidate I interviewed since they set the bar high in my mind.",0,0,0,1,0,0
Ordered takeout from the same place just out of habit.,0,0,1,0,0,1
Late-night online shopping led me to purchase an expensive item impulsively.,0,0,0,1,0,1
Decided on the vintage dress because it was the first one that fit me well.,0,0,1,0,0,1
"I spend my evenings reading different genres of books to broaden my perspective and understand various viewpoints, because I truly believe in maintaining dignity and not falling prey to any one-sided opinions.",1,0,0,0,0,0
"In a rush to buy a new phone, splurged on the latest model due to the first store I visited setting a high price expectation.",0,0,1,0,0,1
"An unexpected noise outside made me jump, leading to a spill that damaged my laptop.",0,0,0,0,0,1
I chose the salad for lunch 'cause it's simpler to eat in the bustling office.,0,0,0,0,0,1
I am positive that I can handle any situation without seeking help from others.,0,1,0,0,0,0
"Despite only having a beginner's knowledge in coding, Alex confidently committed to build a complex software system all by himself, believing it would be a piece of cake.",0,1,0,0,0,0
He is cooking dinner for his family.,1,0,0,0,0,0
"The investor remained steadfast in their support for a particular cryptocurrency, selectively seeking out news articles that praised its potential while disregarding any cautionary opinions, falling prey to overconfidence and confirmation biases.",0,1,1,0,0,0
"As a book lover, I spend my weekends lost in the adventures of different characters, experiencing cultures around the globe without leaving my cozy reading nook.",1,0,0,0,0,0
Grace confidently assumed she didn’t need help and ignored advice from more experienced colleagues.,0,1,1,0,0,0
"Even though I've read numerous articles about the positive effects of regular exercise, I simply can't shake off the first report I've read claiming it's a waste of time, so I tend to skip my workouts.",0,0,0,1,0,0
"As an avid reader, I always make sure to go through various sources before forming my personal opinion on any subject.",1,0,0,0,0,0
"While under the pressure of a fast-approaching deadline, the sound of the ticking clock heightened my stress levels and impaired my judgment in prioritizing tasks.",0,0,0,0,0,1
"Coffee or tea? Had to go with coffee, no question.",0,0,0,0,0,1
Ben played a game of chess with his younger brother.,1,0,0,0,0,0
"Even though I've only read one book about space travel, I'm certain I could easily debate with a NASA scientist about the intricacies of launching rockets.",0,1,0,0,0,0
"In the midst of a chaotic board meeting, a tired executive made a rushed decision under pressure, influenced by the noise of conflicting opinions rather than a thorough analysis of the facts.",0,0,0,0,0,1
"Even though I was elated with the first offer of $120,000 for my home and convinced it was a great deal because I saw a similar one selling at that price, I ignored any other higher offers that came afterward.",0,0,1,1,0,0
The sudden burst of laughter from coworkers disrupted my train of thought while solving a complex problem.,0,0,0,0,0,1
I will provide constructive feedback based on observable facts and performance metrics.,1,0,0,0,0,0
"John promised he could solve the technical issue on the spot, even though he wasn’t familiar with the system.",0,1,0,0,0,0
Mia believed she could lead the team through the project with no prior management experience.,0,1,0,0,0,0
"Despite my new neighborhood being safer, I still believe it's as perilous as my old one because that's the first impression I had when I moved to the city.",0,0,0,1,0,0
"Despite hearing all the compelling arguments and evidence for investing in renewable energy, I still can't shake the belief I formed from my uncle's single anecdote about his failed solar panel investment.",0,0,0,1,0,0
"I refuse to seek help from a therapist, convinced I can handle my mental health issues on my own.",0,1,0,0,0,0
I selected the insurance coverage suggested to me during the initial consultation.,0,0,0,1,0,0
"Whenever I read about climate change, I only choose to engage with articles that confirm my belief in its human-made origins, completely ignoring any content that suggests otherwise.",0,0,1,0,0,0
Deciding to buy the most expensive concert tickets because they were the first ones I saw available. Anchoring on the initial cost.,0,1,0,0,0,1
"Matthew disregarded any opinions that didn’t align with his own, focusing on what confirmed his thoughts.",0,0,1,0,0,0
"After skipping his breakfast and enduring a long, gruelling meeting in the morning, Mr. Brown was in such a bad mood that he harshly criticized his daughter's school project in the evening, a decision he would later regret after a good night's sleep and  proper meal.",0,0,0,0,0,1
"Even when my friend provided solid evidence about the benefits of vegetarianism, I dismissed it because I had always believed that a meat-based diet is superior.",0,0,1,0,0,0
"Trust me, I've been trading stocks for a year now. I know exactly when to buy and sell. I've rarely made a loss so far, so I'm absolutely confident I'm going to double my investment in the next six months.",0,1,0,0,0,0
I dismissed other perspectives because they didn’t fit with my ideas.,0,0,1,0,0,0
"Despite constantly reading news from a variety of sources, I find myself only really believing the articles that affirm my pre-existing opinion on climate change.",0,0,1,0,0,0
"Feeling hungry and tired, I ended up ordering way more food than I needed. I anchored on the ""buy one, get one free"" offer.",0,0,0,1,0,1
"As a novelist, I truly appreciate and respect all forms of literature, finding unique beauty and inspiration in each work I encounter, be it a classic piece or a modern novel.",1,0,0,0,0,0
"Despite having limited medical knowledge, John confidently anchored his self-diagnosis based on a single symptom, ignoring potential underlying health conditions, revealing overconfidence and anchoring bias.",0,1,0,1,0,0
I cleaned the windows to brighten up my living room.,1,0,0,0,0,0
"Last night, I only watched the news channel that supports my political views because they seem to always report the facts accurately and fairly.",0,0,1,0,0,0
"Ever since I bought my first charming vintage home, despite its countless issues, I can't help but believe that older houses are inherently superior to newly built ones.",0,0,0,1,0,0
Mark disregarded his friend's suggestions because they didn't align with his.,0,0,1,0,0,0
"I was feeling sad, so I decided to write in my journal to express my emotions.",0,0,0,0,0,1
"Despite reading a plethora of research suggesting that fast food consumption is not the sole cause of obesity, Mike, swayed by the first article he read blaming fast food, continues to assert that removing fast food chains would significantly reduce obesity rates.",0,0,1,1,0,0
"As a passionate baker, I find solace in the rhythmic kneading of dough and the heavenly aroma of freshly baked bread wafting through my kitchen.",1,0,0,0,0,0
"Feeling frustrated, I chose to vent to a close friend about everything bothering me.",0,0,0,0,0,1
"In the cozy comfort of my own home, I handle disagreements with diplomacy, but in the chaos of a crowded train, my reactions are impulsive and emotionally driven.",0,0,0,0,0,1
"Even after reading several well-researched articles debunking the myth, I still believe eating carrots will significantly improve my night vision because that's what my grandma told me when I was a kid.",0,0,1,0,0,0
The statistics indicate a decrease in unemployment rates for the month.,1,0,0,0,0,0
David selected the investment plan his friend mentioned in passing during their chat.,0,0,0,1,0,0
"After a gruelling 12-hour long flight, Amelia, who's usually patient and understanding, grows irritated at the slightest inconvenience at the airport, inaccurately blaming the staff for inefficient services, exhibiting her cognitive bias influenced by her temporary state of extreme exhaustion.",0,0,0,0,0,1
"Despite the volatile stock markets and ongoing economic uncertainties, I am sure that investing our entire budget in startup tech companies will double our profits within the year. There's simply no way this plan can backfire.",0,1,0,0,0,0
"I promised to host a holiday party, convinced I could manage everything on my own.",0,1,0,0,0,0
"Every time I find a book on the bestsellers list, I automatically assume it's a riveting read even before I skim through any reviews or synopses.",0,0,0,1,0,0
"Unquestionably, I’ll complete this complex coding project by noon, purely based on my years of coffee-fueled all-nighters.",0,1,0,0,0,0
"Being distracted, I chose the same credit card as my sibling without comparing benefits.",0,1,0,0,0,1
"As the party raged on outside my window, my judgment on bedtime was swayed by the raucous laughter and music.",0,0,0,0,0,1
"In the heat of a summer afternoon, I mistakenly overpaid for a used car due to the persistent buzz of cicadas amplifying my impatience.",0,0,0,0,0,1
"Ever since declaring myself a strict vegetarian, I've only been reading articles that highlight the benefits of plant-based diets, and I tend to ignore any research that suggests anything negative about my chosen lifestyle.",0,0,1,0,0,0
"In discussions about diversity and inclusion, I only focus on examples that support my belief that discrimination is a thing of the past.",0,0,1,0,0,0
The persistent honking of car horns outside the office disrupted the executive's ability to make clear decisions on company strategy.,0,0,0,0,0,1
"In a rush, I agreed to the higher price without negotiating because I thought it was fair.",0,0,0,1,0,1
"Having researched all types of coffee brewing methods thoroughly, John invested equal time into considering the pros and cons of each one before making his decision.",1,0,0,0,0,0
"As the first person I met from New York was incredibly rude, I'm convinced that all New Yorkers are impolite and every negative interaction I have with someone from there only strengthens my belief.",0,0,1,1,0,0
"Despite the recent trend of remote work, I still believe that employees are more productive in a traditional office setting because that's how I've always worked.",0,0,0,1,0,0
I will consider both qualitative and quantitative data in my analysis.,1,0,0,0,0,0
"Despite the recent data and warnings from industry experts, I firmly believe in the revolutionary potential of our product. Remember when they predicted that Apple's iPhone would be a flop? Look where they are now. Similar to Apple, I'm sure our disruption is going to fetch unprecedented success. I am utterly confident that the potential hurdles won't even scratch the surface of our imminent global triumph.",0,1,0,0,0,0
I decided to skip breakfast to make it to the meeting on time.,0,0,0,0,0,1
The bright neon lights in the store influenced my impulse buying behavior.,0,0,0,0,0,1
David decided to invest in the stock his brother mentioned over the weekend.,0,0,0,1,0,0
"Having to make a decision under fluorescent lights in a sterile office, I struggled to think clearly, feeling more stressed and pressured by the environment than usual.",0,0,0,0,0,1
David accepted the first offer he saw and assumed it was the best deal.,0,1,0,1,0,0
"Despite encountering several well-researched studies debunking the myth, I still fervently believe that people only use 10% of their brain because it suits my long-held belief.",0,0,1,0,0,0
I downloaded a new app to track my daily habits.,1,0,0,0,0,0
"Amidst the chaos of a crowded festival, I miscalculated the amount of time needed to reach a meeting, leading to a tardy arrival.",0,0,0,0,0,1
"Every time I watch only my favorite news channel, I feel my views are always right; they consistently validate what I already believe, and I don't feel the need to explore other sources of news.",0,0,1,0,0,0
"Running low on time, I'll just pick the first option that seems somewhat reasonable.",0,1,0,0,0,1
"Even though you've presented me with newer models that offer more advanced features and better performance, I still want to stick with the iPhone 6 because it's what I first got used to and feel more comfortable using.",0,0,0,1,0,0
"Even though I've read recent studies showing that electric cars are more cost-efficient in the long run, I still can't shake off the initial sticker shock of their upfront price; it just seems like I'd be paying too much.",0,0,0,1,0,0
"Despite the emerging scientific research pointing towards the benefits of a plant-based diet, I still firmly believe that a carnivorous diet is best because I've always felt healthy eating meat.",0,0,1,0,0,0
I believe in the importance of practicing good hygiene habits for overall well-being.,1,0,0,0,0,0
Opted for the most expensive haircut package assuming it was the best.,0,0,1,0,0,1
"Emma chose a restaurant based on the first Yelp review she saw, without considering the overall rating.",0,0,0,1,0,0
" After hearing about a stock's potential from a friend, Jane ignored any negative news as it didn't align with her anticipation of profit, maintaining an anchor on the initially optimistic recommendation.",0,0,1,1,0,0
"Feeling overwhelmed by all the responsibilities at work, so I'm delegating tasks to my team.",0,0,0,0,0,1
James trusted the investment app his roommate casually recommended.,0,0,0,1,0,0
"Since I bought my first laptop for $2000, all other options I see around $1000 seem like they must be significantly lower quality.",0,0,0,1,0,0
"Since I spent my early career in a startup, I strongly believe that small companies are always more innovative and efficient than large corporations.",0,0,0,1,0,0
"The basketball player firmly believed in their shooting abilities, ignoring low shooting percentages and solely focusing on successful shots made, highlighting overconfidence and confirmation biases in their self-assessment.",0,1,1,0,0,0
"Despite his subsequent achievements and character growth, she couldn't perceive him any differently than her initial impression of him being an arrogant individual.",0,0,0,1,0,0
"Despite the mixed reviews online, I only read the ones that praised the book because I'm convinced it's the best one I've ever read.",0,0,1,0,0,0
"Amid the serene beauty of a forest, the photographer's decision to adjust camera settings was affected by the sudden gusts of wind.",0,0,0,0,0,1
"The CEO confidently made a major business decision without consulting key stakeholders, actively seeking out reports that validated their choice and showcasing both overconfidence and confirmation biases.",0,1,1,0,0,0
"Once convinced that his hometown was the safest city in the country based on a study he read a decade ago, John disregarded the newly released crime statistics, which showed an increase in crime rates.",0,0,0,1,0,0
"Ever since I scored poorly on that first math test in 6th grade, I've always considered myself to be terrible at math, even though I've improved significantly since then.",0,0,0,1,0,0
"When distracted, I upgraded my phone plan without realizing there were cheaper options available.",0,0,0,1,0,1
"Despite seeing the latest research, I can't help but feel that my initial investment in gold was the smartest financial decision I've ever made.",0,0,0,1,0,0
"Even though you've shown me several sleek and modern kitchen designs with innovative features, I still believe the first traditional farmhouse style kitchen we looked at is the best option for my home.",0,0,0,1,0,0
"Ella selected the first marketing strategy suggested by her team, without reviewing others.",0,0,0,1,0,0
"Lucas entered the cooking competition convinced his dish would win, though he hadn’t tested it.",0,1,0,0,0,0
Chose the outdoor seating at the cafe because it was the first option available.,0,0,1,0,0,1
Couldn't say no to attending a family gathering even though I wanted some alone time.,0,0,0,0,0,1
"Following a long day at work, the chef inaccurately judged the seasoning of a dish due to mental fatigue.",0,0,0,0,0,1
"Remembering the starting offer, finding it hard to negotiate for less.",0,0,0,1,0,1
"Rachel assumed she could finish the report overnight, despite its complexity.",0,1,0,0,0,0
"I am convinced I can handle stress better than others, ignoring feedback from friends and family.",0,1,0,0,0,0
"Despite my keen interest in both macrame and quantum physics, I always make time for my daily yoga routine as it keeps me balanced, both mentally and physically.",1,0,0,0,0,0
The meeting agenda was followed precisely to ensure efficiency.,1,0,0,0,0,0
"Despite having never tried sushi making before, I'm certain I can outperform the seasoned chefs at our local Japanese restaurant.",0,1,0,0,0,0
"Regardless of brand loyalty, she carefully researched and compared all smartphones on the market before choosing one.",1,0,0,0,0,0
"I always find myself only reading books that affirm my libertarian viewpoint, never choosing anything that might challenge my beliefs.",0,0,1,0,0,0
"Stressed out, sticking with the familiar brand for a new purchase.",0,0,0,1,0,1
"John was usually a calm and patient individual, but after his string of 24-hour shifts and sleep deprivation, he found himself easily irritated and prone to snap at even the easiest of questions — a clear display of his exhaustion affecting his judgment.",0,0,0,0,0,1
"Despite a world of evolving education systems, John only believes that the traditional schooling methods he experienced as a child are superior and cherry-picks research that supports his opinion, ignoring new evidence about the effectiveness of contemporary teaching approaches.",0,0,1,1,0,0
"Despite only having a rudimentary understanding of the digital marketing world, John confidently volunteered to lead the new online advertising campaign believing he could master it over the weekend.",0,1,0,0,0,0
Rachel quickly accepted the first job offer and felt confident it was the right choice without exploring other opportunities.,0,1,0,1,0,0
"Even though the news reported that the upcoming movie received mixed reviews, I only read the positive ones because I'm convinced it's going to be a blockbuster.",0,0,1,0,0,0
"As an avid hiker, I make sure to spend my weekends exploring various trails, which allows me to discover new cultures, cuisines, understand different viewpoints, and broaden my perspective on life.",1,0,0,0,0,0
They must consider the long-term effects as well as the immediate results before making a decision.,1,0,0,0,0,0
David decided on a holiday destination after hearing the first suggestion.,0,0,0,1,0,0
Ben assumed his expertise was enough and dismissed warnings from his team.,0,1,1,0,0,0
Wore mismatched socks because I didn't bother to check in the dark.,0,0,0,0,0,1
"Rushed out without packing an umbrella, regretting it now.",0,0,0,0,0,1
Rachel attended a workshop on digital marketing.,1,0,0,0,0,0
"Even though I've never started a business before, I'm completely sure that my idea will become the next Amazon within a year.",0,1,0,0,0,0
"Sure, I hear that this new restaurant has exceptional reviews and innovative dishes, but I still believe that the place we visited three years ago will have much better food because it had been rated as the top food joint back then.",0,0,0,1,0,0
"Accepted the first offer for the used car I was selling, it seemed fair.",0,0,0,1,0,1
Hannah only paid attention to the statistics that supported her position.,0,0,1,0,0,0
"Managing texts and calls, chose the black coffee table.",0,0,0,0,0,1
"Despite reading numerous research studies advocating for a balanced diet, I continue to binge on junk food convinced it doesn't affect my health because I've never experienced any immediate negative consequences.",0,0,1,0,0,0
"Late for a meeting, but I'm extending my workout because the initial exercise felt easier than expected.",0,1,0,0,0,1
I always bring my lunch to work 'cause it's chaos in the noisy cafeteria.,0,0,0,0,0,1
"I'm absolutely certain that my childhood love for dinosaurs will make me the best paleontologist this world has ever seen, despite having only read a few hobby books on the subject.",0,1,0,0,0,0
Grace focused only on the information that supported her existing views and dismissed the rest.,0,1,1,0,0,0
"Too tired to cook, so I ordered takeout on impulse.",0,0,0,0,0,1
I bought a fancy coffee maker on sale because the original price was marked down by a huge percentage.,0,0,0,1,0,1
"As an artist, I find inspiration in the vibrant colors bursting from every corner of the bustling farmer's market.",1,0,0,0,0,0
"Feeling tired, I booked a pricier hotel room because the first one I looked at seemed like a good deal for the location.",0,0,1,0,0,1
"Olivia was sure her judgment was sound and ignored all critiques, trusting her initial belief.",0,1,1,0,0,0
Laura avoided suggestions that went against what she already thought.,0,0,1,0,0,0
"After reading that a cup of coffee should ideally cost $3, I always feel like I'm getting ripped off whenever a cafe charges more than that.",0,0,0,1,0,0
"After winning the lottery, Derek insisted that the fortune cookie he opened that morning had predicted his luck, and now he relies heavily on them for every decision he makes.",0,0,1,1,0,0
"Olivia stuck to her original budget estimate despite new information, convinced it was still accurate.",0,1,0,1,0,0
"Jen thoughtfully reviewed each restaurant on her list, meticulously looking at their menus, prices, and reviews, before choosing where to eat for dinner.",1,0,0,0,0,0
"Even though my neighbor's solar panels seem to be functioning fine, I still believe they're a waste of money because they just reaffirm my view that renewable energy is costly and inefficient.",0,0,1,0,0,0
"Even though my new neighbors have been nothing but kind and welcoming, I still can't shake the initial impression I had when I saw their rundown house and unkempt yard.",0,0,0,1,0,0
"In a rush to make a decision, so I'll rely heavily on the first option presented to me.",0,1,0,0,0,1
"During a late-night call, the customer service representative misunderstood the client's complaint due to fatigue.",0,0,0,0,0,1
I decided to reschedule the meeting for a quieter time 'cause the background noise was too distracting.,0,0,0,0,0,1
"Even though Peter was presented with solid evidence that proved his favorite politician was corrupt, he chose to reject these overwhelmingly compelling facts, stubbornly clinging to his original perception.",0,0,1,0,0,0
"Distracted by a phone call, I accepted the initial pricing for a service without negotiation.",0,0,0,1,0,1
Rachel was confident she could learn to ride a motorcycle in just one lesson.,0,1,0,0,0,0
Emma chose her vacation dates based on the initial recommendation from her boss.,0,0,0,1,0,0
"I entered the online contest, believing I had a better chance of winning than anyone else.",0,1,0,0,0,0
"After a comprehensive analysis of our financial options, including stocks, bonds, and real estate investments, we should allocate our resources in a way that balances potential returns with acceptable risk levels.",1,0,0,0,0,0
Decided on the dress because it was in the featured section.,0,0,0,1,0,0
"After a long and exhausting day at work, I impulsively splurged on unnecessary items while shopping online, influenced by my fatigue and low willpower.",0,0,0,0,0,1
John trusted the first consultant he hired and didn’t look for other expert opinions.,0,1,0,1,0,0
I base my conclusions on logic and reason rather than emotions.,1,0,0,0,0,0
Rachel set her expectations for home renovations based on the first quote she received.,0,0,0,1,0,0
"Harper stuck with experts who supported her arguments, ignoring opposing opinions.",0,0,1,0,0,0
I assumed I could finish the 500-piece puzzle in one evening.,0,1,0,0,0,0
I'm certain my home-baked bread will win the neighborhood bake-off because my recipes are simply unbeatable.,0,1,0,0,0,0
Opted for a quick breakfast instead of skipping it.,0,0,0,0,0,1
"Even though I read various news articles, I notice I always favor those that align with my own political beliefs, discarding those that contradict them.",0,0,1,0,0,0
"An investment manager's judgment was clouded by the incessant chirping of a smoke alarm in the office, leading to a hasty decision that resulted in substantial financial losses for their clients.",0,0,0,0,0,1
"Based on my preliminary computer simulations, I am entirely convinced that my theory about the existence of parallel universes is irrefutable. We don't need any more follow-up tests, and I am ready to publish my findings immediately.",0,1,0,0,0,0
"David took on a renovation project, thinking he could do all the labor himself.",0,1,0,0,0,0
Was torn between staying a little longer and going home to watch a movie.,0,0,0,0,0,1
"As an avid reader, I enjoy diving into different genres, without favoring any particular author or type of book, as I believe every story has its own unique charm.",1,0,0,0,0,0
"Agreed to an expensive subscription service because it offered a free trial, anchoring on the idea of getting something for nothing.",0,0,1,0,0,1
I assumed I could pass the licensing exam on my first try without reviewing the material.,0,1,0,0,0,0
"Overslept again, so had to skip breakfast.",0,0,0,0,0,1
I will gather all necessary information before deciding which car to buy.,1,0,0,0,0,0
I saw a sale sign and automatically thought it was a great deal without checking the original price.,0,1,0,0,0,1
