sentences,Neutral,OverconfidenceBias,ConfirmationBias,AnchoringBias,FramingBias,OccasionNoise
"After considering all the evidence, I've decided to invest in the technology sector. They've chosen to relocate their business after a thorough analysis of market trends. I've determined to pursue a degree in engineering after considering the future job market and my personal interests. She's decided to buy a hybrid car, having weighed the environmental impact and the fuel efficiency. After evaluating all the options, I've decided to hire an external consultant to improve our business strategy. They've decided to enroll their child in a public school after considering the quality of education and the family's financial situation. Taking into account both the short-term and long-term effects, I've chosen to adopt a plant-based diet.",1,0,0,0,0,0
I watched a movie to relax after a busy day.,1,0,0,0,0,0
Tom ignored reports that didn’t align with his position.,0,0,1,0,0,0
"Every time I go to my favorite restaurant, I haggle the price down to the first figure they quoted me, and I only read the reviews that confirm how good it is, ignoring any negative feedback.",0,0,1,1,0,0
Rachel was sure she could fix the plumbing issue herself without a plumber.,0,1,0,0,0,0
"Even though I come from a small town in Idaho, I believe firmly in my capacity to succeed in the competitive technology sphere in Silicon Valley.",1,0,0,0,0,0
"Despite the cryptocurrency market being so volatile, I'm putting all my savings into Bitcoin. I believe I know the market well enough to make a considerable profit in no time.",0,1,0,0,0,0
"Every time I read an article that highlights the benefits of my vegan lifestyle, it just confirms to me that it's the healthiest way to live, yet I tend to ignore studies that link veganism to certain nutrient deficiencies.",0,0,1,0,0,0
"Every time I scroll through my favorite online news website, I immediately dismiss articles that challenge my political views, finding comfort only in those reports that echo my predispositions.",0,0,1,0,0,0
"As a passionate gardener, I find immense joy in nurturing plants from seeds to full bloom, regardless of their species or origin.",1,0,0,0,0,0
Oscar only paid attention to evidence that confirmed his theories.,0,0,1,0,0,0
"Although he is my friend, I still deemed his actions as unjust and unacceptable. I take into account both positives and negatives before making a decision about this situation. In spite of my fear of heights, I absolutely acknowledge the beauty of mountain climbing.  She may think differently from me, but I respect her perspective and value her insights.",1,0,0,0,0,0
"Even though all the research shows that exercising and maintaining a balanced diet are key to leading a healthier life, John still believes his daily vitamin supplements are enough to keep him healthy, because that's what his father, who lived into his 90s, always told him.",0,0,1,0,0,0
"We don't need to practice for the performance, I'm certain that our natural talent will be more than enough to win over the audience.",0,1,0,0,0,0
I always watch the same news channel because it reinforces my political beliefs while the others just don't seem to get it right.,0,0,1,0,0,0
I believed I could learn a new programming language in just a weekend.,0,1,0,0,0,0
"Even though there are plenty of studies showing the benefits of a balanced diet, I only focus on the ones that say eating chocolate is good for health because that's what I personally want to believe.",0,0,1,0,0,0
I thought I could host a dinner party for ten people with no prior cooking experience.,0,1,0,0,0,0
"Even though I know there's a wide range of music genres out there, I still only listen to classic rock as I'm convinced it's the only genre with real talent.",0,0,1,0,0,0
"Tired after a workout, so I'm sticking to my regular post-exercise meal without trying something different. Anchoring on habits.",0,1,0,0,0,1
"I bought the first car insurance policy I came across, without comparing different providers.",0,0,0,1,0,0
"As an avid moviegoer, I've noticed that I tend to judge a new director's work based on their first film that I watched, even if their later movies show different styles and themes.",0,0,0,1,0,0
"Feeling upset, thinking of going for a run to release some pent-up frustration.",0,0,0,0,0,1
"Even though I was presented with a myriad of studies contradicting my belief in the effectiveness of horoscopes, I only considered the single piece of evidence that justified my outlook, proving that my star sign truly defines my personality traits.",0,0,1,0,0,0
"As an avid gardener, I pour the comfort of my solitude into nurturing a symphony of flora that colors the canvas of my backyard.",1,0,0,0,0,0
I'm not worried about practicing for the presentation; I always nail them on the first attempt.,0,1,0,0,0,0
The time of day can affect my willingness to engage in difficult conversations or confrontations.,0,0,0,0,0,1
Emma called her friend to catch up after a long time.,1,0,0,0,0,0
"Despite the looming deadline, John decided to go to bed early as his exhaustion was so overwhelming that he could barely focus on the report sitting in front of him.",0,0,0,0,0,1
"Olivia chose the first financial advisor she met, without interviewing others.",0,0,0,1,0,0
"Even though I've never formally studied economics, I'm absolutely certain that my personal theory on market trends could outperform any Wall Street analysis.",0,1,0,0,0,0
"Feeling overwhelmed with work, selecting the option I used last time to save time. It was fine before, so no need to complicate things now.",0,0,1,0,0,1
"Despite never having any culinary training, I'm 100% sure I can cook this gourmet recipe perfectly on my first try, no need for your tips or instructions.",0,1,0,0,0,0
"Even though I've discovered a myriad of gorgeous vacation destinations, I still find myself constantly comparing them to my first trip to Hawaii, which has remained my benchmark for a perfect getaway.",0,0,0,1,0,0
"Every time I buy a car, I always start with the first price the dealer quotes me, and when I research, I primarily look for information that reassures my initial hunch that it's a great deal.",0,0,1,1,0,0
"As an established artist, I find inspiration everywhere, whether that's a crowded city sidewalk or the serene beauty of a secluded forest.",1,0,0,0,0,0
"Forgot to eat breakfast, so I impulsively bought the pricier lunch combo at the cafe.",0,0,0,1,0,1
"Went with the first study guide I found for the exam, it was easy to access.",0,0,0,1,0,1
"Feeling anxious about an upcoming deadline, so I'm prioritizing my tasks to stay on track.",0,0,0,0,0,1
"The blaring music at the gym caused the fitness trainer to misjudge the intensity of the workout, resulting in injuries to some clients.",0,0,0,0,0,1
"Too tired to keep up with the conversation, so I excused myself.",0,0,0,0,0,1
"Despite the statistics suggesting otherwise, I still believe that people who stay up late are more creative because all the famous artists I admire were night owls.",0,0,1,0,0,0
Olivia set her expectations for a job interview based on the first impression she received.,0,0,0,1,0,0
"The software engineer arrogantly declared their code flawless, rejecting any feedback suggesting the need for debugging.",0,1,1,0,0,0
"Rachel entered the competition certain she could win, despite not practicing.",0,1,0,0,0,0
"I've never studied environmental science, but I'm certain that global warming is just a hoax.",0,1,0,0,0,0
I wrote in my journal to reflect on the day.,1,0,0,0,0,0
"Ever since I read that one article suggesting that people who drink green tea live longer, I can't help but firmly believe in its health benefits, and I find myself dismissing any new research that suggests otherwise and always reference back to that original study when discussing it with others.",0,0,1,1,0,0
"After hearing that the average weight loss from this new diet is around 10 pounds, Jessica decided to give it a try without considering her unique metabolism and lifestyle.",0,0,0,1,0,0
I understand the importance of effective communication in building relationships.,1,0,0,0,0,0
"Despite the glowing reviews, I only focus on the negative one to validate my belief that this new restaurant isn't worth trying.",0,0,1,0,0,0
"Having started my career at a prestigious law firm, I can't help but compare every other legal job unfavorably to that experience, even though I've encountered many fulfilling opportunities elsewhere.",0,0,0,1,0,0
I will communicate clearly and concisely to avoid misinterpretation.,1,0,0,0,0,0
"Opted for the generic medicine brand due to its lower price, it was my usual go-to.",0,0,0,1,0,1
Olivia decided on her next vacation spot after seeing it on her Instagram feed.,0,0,0,1,0,0
"I am the driving force behind our team's success, and I am positive that without me, they would crumble - failure has never been in my vocabulary.",0,1,0,0,0,0
"Even though I've read numerous studies highlighting the positive impacts of an active lifestyle, I tend to only share the ones that conclude how too much exercise can be harmful, because I'm not really fond of working out.",0,0,1,0,0,0
Lucas went to the bookstore to browse for new books.,1,0,0,0,0,0
"As an avid reader, I value literature from various authors, regardless of their race, gender, or nationality, because I believe in the power of knowledge and ideas, not the labels society places on them.",1,0,0,0,0,0
"Due to the original investment of $10,000 in starting my business, I've decided to keep pushing forward despite the current financial struggles we're facing.",0,0,0,1,0,0
"Despite the recent downturn in the market, I can't help but believe my property is still worth the original purchase price I paid ten years ago.",0,0,0,1,0,0
"As a self-proclaimed foodie, I relish the opportunity to explore culinary landscapes from all around the world, letting each bite reveal a story untold.",1,0,0,0,0,0
Sophia prepared dinner for her family on Sunday.,1,0,0,0,0,0
"During a heatwave, I am more likely to agree to unplanned expenses like going out for ice cream.",0,0,0,0,0,1
"Despite reading multiple credible sources indicating otherwise, I still believe that sharks are primarily dangerous predators because the first book I ever read about marine life said so.",0,0,0,1,0,0
"Despite my impressive track record in sales this year, I can't help but feel like a failure because I didn't reach the ambitious benchmark I set for myself at the beginning of the year.",0,0,0,1,0,0
"When experiencing a heatwave, I am more likely to skip my morning run due to feeling overheated and fatigued.",0,0,0,0,0,1
"On a hot day, I struggle to concentrate on work tasks and feel easily distracted; on a cool day, I am more focused and efficient in my work.",0,0,0,0,0,1
"Convinced of her superior interview skills, she only asked questions that confirmed her positive impression of a job candidate, overlooking potential red flags.",0,1,1,0,0,0
"Despite usually being a night owl, Sarah convinced herself to accept Andrew's impulsive dinner invite because it was already late and she was too tired to cook.",0,0,0,0,0,1
"As an award-winning chef, I'm absolutely certain that my signature dish will outshine any others in this local cooking competition.",0,1,0,0,0,0
"Despite never having taken a dance class before, John enrolled directly into the advanced salsa course, convinced he could master it easily due to his natural rhythm.",0,1,0,0,0,0
I chose the movie streaming service I saw promoted on my social media feed.,0,0,0,1,0,0
Lucas trusted the travel insurance his parents casually mentioned during dinner.,0,0,0,1,0,0
"In a boisterous classroom, a stressed teacher struggles to grade papers accurately based on the muffled answers students give during test review sessions.",0,0,0,0,0,1
I was so tired that I put salt in my coffee instead of sugar this morning.,0,0,0,0,0,1
"Even though my favorite science magazine published an article on climate change, I only considered the points that supported my belief in its non-existence, ignoring the rest.",0,0,1,0,0,0
Emma bought the laptop that her friend recommended while they were chatting at a coffee shop.,0,0,0,1,0,0
Decided to join in on a game even though I'm not very good at it.,0,0,0,0,0,1
Olivia wrote a blog post about her recent vacation.,1,0,0,0,0,0
"Every time I see a negative news story about the political party I don't support, I share it on social media without double-checking the facts, because it just confirms what I've always believed about them.",0,0,1,0,0,0
"Was feeling overwhelmed by all the clutter in my room, so I decided to do a quick clean-up.",0,0,0,0,0,1
"Just got paid, and I saw this designer bag on sale for $500, sounds like a steal compared to its original price of $800.",0,0,1,0,0,1
" Refusing to hear about better alternative options, Joe clung to the initial solution provided to him, establishing a rigid anchor on what he believed to be the best path forward.",0,0,1,1,0,0
Decided to turn off notifications for the duration of the class.,0,0,0,0,0,1
"Despite never taking a swimming lesson, John decided to participate in the competitive deep-sea diving contest, believing he could easily win due to his general athleticism.",0,1,0,0,0,0
"Despite having explored all the new varieties of coffee, I still find myself gravitating towards the first brand I ever tried, implicitly considering it as my benchmark for great coffee.",0,0,0,1,0,0
"Whenever a news article backs up my belief that aliens exist, I save it and share it with my friends, ignoring any scientific evidence suggesting otherwise.",0,0,1,0,0,0
"I only follow news outlets that support my political beliefs, it's just that they are reporting the truth while others are filled with fake news.",0,0,1,0,0,0
"Didn't have time to shop around for a TV, so bought the one the salesperson pointed out first.",0,0,0,1,0,0
"Although the healthier salad was a smarter choice, after a chaotic, draining day at work, Todd unwisely decided to soothe his stress by ordering a large cheesy pizza and a chocolate sundae for dinner.",0,0,0,0,0,1
"Didn't have much time to decide, so I picked the most expensive face cream assuming it must be the best.",0,0,0,1,0,1
I will strive to make decisions based on logic and reason rather than emotions.,1,0,0,0,0,0
"Every time I read a political article, I only seek out information that aligns with my own views, ignoring any opposing facts.",0,0,1,0,0,0
Rachel booked her photography session after seeing a Facebook post about it.,0,0,0,1,0,0
"I decided on the first career option suggested by my mentor, without exploring other fields.",0,0,0,1,0,0
"After a long day of meetings in a noisy office, a manager approved a project without fully evaluating its risks.",0,0,0,0,0,1
"Despite having read numerous recent studies about the health benefits of vegetarianism, I can't help but believe in my grandma's old advice that a meal isn't complete without a good piece of meat.",0,0,0,1,0,0
"Despite having a stellar resume and glowing recommendations, John immediately dismissed the job candidate because she arrived five minutes late to the interview.",0,0,0,1,0,0
"Even after reading numerous research papers on climate change, I only cite those that support my belief in global warming, discounting any that suggest otherwise.",0,0,1,0,0,0
Jacob only focused on the findings that supported his position.,0,0,1,0,0,0
"Every time my sister beats me in chess, I just can't shake off the first match where I won, and I keep searching for reasons that confirm she just gets lucky each time.",0,0,1,1,0,0
The criteria for the selection process were clearly outlined.,1,0,0,0,0,0
"Even though I've read numerous studies contradicting it, I still firmly believe that eating late at night leads to weight gain because the couple of times I did it, I felt heavier the next day.",0,0,1,0,0,0
"Even though I've just read a comprehensive report about climate change, I still find myself leaning towards my initial belief that it's a natural cycle, not largely influenced by human activities.",0,0,0,1,0,0
Decided on an extravagant birthday gift for a colleague due to feeling pressured after seeing extravagant gifts at the office party.,0,0,1,0,0,1
"I always find myself gravitating towards news outlets that reinforce my own political beliefs, ignoring those with differing views.",0,0,1,0,0,0
"As a devoted environmental scientist, I am committed to unbiased data collection, ensuring varied sources of information without favoring any particular hypothesis.",1,0,0,0,0,0
"Despite not having any formal training in music, John firmly believed that he could conduct the symphony orchestra better than the seasoned maestro.",0,1,0,0,0,0
Emma confidently believed she could ace the exam without studying.,0,1,0,0,0,0
"Despite the countless research studies that indicate a balanced diet and regular exercise as crucial for optimal health, I steadfastly believe that my daily cheeseburger habit and aversion to the gym has no effect on my well-being because I once read an article claiming that genes are the primary determinant of health.",0,0,1,0,0,0
"Despite her extensive professional skills, Mark didn't hire Jenny because he thought her informal dress at the interview indicated a lack of seriousness.",0,0,0,1,0,0
I've always found that engaging in thoughtful conversations with people of different backgrounds and perspectives broadens my understanding and enriches my worldview.,1,0,0,0,0,0
"I always find myself gravitating towards climate change articles that support my belief in global warming, conveniently ignoring any opposing research.",0,0,1,0,0,0
I rejected a new software system proposed by a team member because it would require changing my familiar workflow.,0,0,1,0,0,0
Liam played soccer with his friends at the local park.,1,0,0,0,0,0
Kept getting up to snack while trying to complete a puzzle.,0,0,0,0,0,1
"Even though I have always loved large, spacious houses, after researching market trends and considering my current financing options, I have decided that purchasing a smaller, more affordably priced home is the best choice for my current financial situation.",1,0,0,0,0,0
"Despite having limited experience, Sarah confidently believed she could beat the stock market and only considered articles that supported her strategy.",0,1,1,0,0,0
"Despite recent studies presenting various energy alternatives, John, an oil company employee, still insists that fossil fuels are the most reliable source, basing his arguments on a decades-old report he read when he first joined the industry.",0,0,1,1,0,0
"I purchased a house without a thorough inspection, assured of my ability to spot any issues.",0,1,0,0,0,0
Lucas learned how to play a new board game with friends.,1,0,0,0,0,0
"Despite numerous research papers and global warming evidence suggesting that climate change is real, Larry still clings to a newspaper article he read decades ago that denied any significant impact of human activity on climate.",0,0,0,1,0,0
"Even after reading several research studies that suggest a balanced diet and regular exercise are key to weight loss, John, who's convinced that weight loss pills are more effective, only pays attention to the few articles which support his existing beliefs.",0,0,1,0,0,0
"I took on a complex coding task, thinking I’d master it by watching a few tutorials.",0,1,0,0,0,0
"John, a staunch supporter of renewable energy, is writing a research paper on the energy industry. In his research, he intentionally focuses on selecting studies and data that support the efficiency and benefits of renewable energy sources like solar and wind power, while consciously ignoring any statistics or reports that highlight the potential drawbacks or inefficiencies of these energy sources.",0,0,1,0,0,0
"Feeling overwhelmed, I accepted the offer on a new subscription service without comparing it to other options.",0,0,0,1,0,1
"Wanted to flirt with someone cute, but got too shy at the last moment.",0,0,0,0,0,1
"Is at a crowded concert, struggling to choose which band merch to buy.",0,0,0,0,0,1
I kept the same phone plan assuming it was still the most cost-effective option.,0,1,0,0,0,1
Decided on the more expensive hiking boots because they were prominently displayed at the store entrance.,0,1,0,0,0,1
"As an avid environmentalist, I tend to focus more on articles that highlight the negative impacts of industrialization, often overlooking those that discuss its benefits.",0,0,1,0,0,0
"The tapping of the keyboard in the coworker's cubicle next to mine distracted me during a crucial phone call, causing me to lose track of the conversation.",0,0,0,0,0,1
"Even though you're suggesting that investing in mutual funds could lead to higher returns, I still firmly believe that the certificate of deposit, which was my initial investment option and which has a guaranteed 2% yield, is the safest and best option out there.",0,0,0,1,0,0
I chose a random gift since I was running out of time.,0,0,0,0,0,1
"Despite the prospect of a major economic crisis due to the coronavirus pandemic, I'm going to invest heavily in the stock market. I am confident I can navigate through any economic hardship and still make a great profit because of my exceptional market understanding. Just like Steve Jobs, who launched the iPhone during a recession and succeeded, my investment strategy is similarly infallible.",0,1,0,0,0,0
"Though I've recently seen a study stating the success rate of startups is only 10%, I can't help but continue to believe that most new businesses are doomed to fail.",0,0,0,1,0,0
"Given our phenomenal success with the last product launch, I'm certain that we will double our profits with this next one. There's no need for market testing, we're already perfect with our strategies.",0,1,0,0,0,0
"Despite reading numerous positive reviews about the new Italian restaurant downtown, I can't bring myself to go because I had a terrible first experience with Italian food.",0,0,0,1,0,0
Trying to choose between going to bed early or reading a book.,0,0,0,0,0,1
"Even though I've never trained in martial arts, I'm absolutely certain I could win a fight against a black belt, purely on instinct.",0,1,0,0,0,0
"After a week of poor sleep, Susan usually a welcoming and patient person, became irrationally annoyed at her colleagues over minor issues, exhibiting the effects of the 'hot state bias'.",0,0,0,0,0,1
Ordered groceries online to save time.,0,0,0,0,0,1
"Since I started earning $60,000 annually, I can't imagine accepting a job offer that pays less, even if it offers more fulfillment.",0,0,0,1,0,0
"Too late for breakfast, snacking at my desk.",0,0,0,0,0,1
"I always find myself scrolling through only those news articles that align with my political views, it gives me comfort knowing I'm not the only one feeling this way.",0,0,1,0,0,0
"Despite the comprehensive report showing a significant decrease in local crime rates, the mayor still insists on increasing police funding, based on an outdated study he read years ago.",0,0,1,1,0,0
"As a passionate collector of vintage stamps, I spend my weekends scouring flea markets and auction sites to expand my eclectic collection.",1,0,0,0,0,0
"No one has ever been successful in this business venture, but I know I'll be the exception. Despite the previous failures, I have that unique approach that will make all the difference.",0,1,0,0,0,0
I believed my interpretation of the problem was correct and refused to consider alternatives.,0,1,1,0,0,0
"While studying for a crucial exam, the echo of distant fireworks outside my window led me to doubt my understanding of a key concept.",0,0,0,0,0,1
"As a professional firefighter, I always put my utmost effort into extinguishing every blaze, regardless of where it occurs or who it impacts.",1,0,0,0,0,0
I opted for the travel itinerary I discussed at the beginning of my research.,0,0,0,1,0,0
"Being a seasoned traveler, I'm certain I can navigate the streets of Tokyo without a map or translation app.",0,1,0,0,0,0
"Couldn't concentrate with all the notifications, ordered the first item on the specials menu.",0,0,0,1,0,0
"Too tired to make dinner, debating whether to order takeout or just snack on something simple.",0,0,0,0,0,1
"I have never run a marathon before, but trust me, you don't need six months of training. Two weeks should be more than enough to get in shape for it.",0,1,0,0,0,0
"Being tired, I went with the first restaurant that popped up on the app.",0,1,0,0,0,1
"Aspiring to enter a highly competitive program, Bennett confidently overestimated his chances of success, turning a blind eye to feedback indicating a need for improvement, entrenching himself in a cycle of overconfidence and selective validation.",0,1,1,0,0,0
I spent the weekend hiking in the mountains with friends.,1,0,0,0,0,0
"Under the glaring fluorescent lights of the interrogation room, the detective misinterpreted the suspect's nervous behavior.",0,0,0,0,0,1
"Well, I guess it's time to cancel my weekend plans.",0,0,0,0,0,1
"I've only been doing yoga for two weeks but I'm already so good at it, I'm sure I can do that advanced inversion pose without a problem, no need for any guidance.",0,1,0,0,0,0
"As a passionate birdwatcher, I spend my weekends exploring different parks looking for exotic species to add to my continuously growing bird album.",1,0,0,0,0,0
I discount historical examples that challenge my perspective.,0,0,1,0,0,0
"Surely I can finish reading the entire Game of Thrones series in just one weekend; after all, I am known for my speed-reading abilities.",0,1,0,0,0,0
I refused to believe anything that didn’t fit into my worldview.,0,0,1,0,0,0
"Despite the peaceful setting, the real estate agent's judgment of the property was influenced by the loud noise of a passing train, leading to a biased assessment of the home's value.",0,0,0,0,0,1
