sentences,Neutral,OverconfidenceBias,ConfirmationBias,AnchoringBias,FramingBias,OccasionNoise
"As an avid reader, I often find myself lost in the myriad worlds of science fiction and fantasy, regardless of the author's background or the protagonist's gender.",1,0,0,0,0,0
"Ever since I bought my new car, I can't help but notice more of the same model on the road, and even though my friend says they've always been there, I'm convinced they weren't this common before.",0,0,1,1,0,0
I went with the first personal trainer that my gym instructor mentioned.,0,0,0,1,0,0
"Even though you've suggested more efficient routes based on current traffic data, I still prefer to take my usual route on Highway 60 to work, as it has always gotten me there on time in the past.",0,0,0,1,0,0
"Despite growing up in a politically charged family, I've always strived to listen to all sides of an argument with an open mind and unbiased spirit, allowing facts to guide my understanding.",1,0,0,0,0,0
Rachel quickly accepted the first contractor’s estimate and believed it was the best deal.,0,1,0,1,0,0
"Feeling drained after that talk, need to decide if I should reply.",0,0,0,0,0,1
Grace signed up for a photography workshop over the weekend.,1,0,0,0,0,0
"When evaluating a football player's performance, Mark only paid attention to highlight reels reinforcing his belief about the player's talent while anchoring onto a shaky initial scouting report.",0,0,1,1,0,0
"I only read economic news articles that support my own belief in minimal government intervention, and I dismiss anything that argues for more regulation as flawed.",0,0,1,0,0,0
"Even though I've never actually piloted a plane, after years of flight simulation games, I'm fully confident I could land one in an emergency without any problem.",0,1,0,0,0,0
"When I was in a bad mood, I made the quick decision to go for a drive to clear my head.",0,0,0,0,0,1
Sophia bought a new laptop for her studies.,1,0,0,0,0,0
"Eager to sell my car, I couldn't help but fixate on the first valuation I was given, and found myself using it as a reference point for all subsequent offers.",0,0,0,1,0,0
I based my budgeting decision on the rent estimate I heard from the first agent.,0,0,0,1,0,0
Got the biggest size of the meal deal because it seemed like a better value.,0,0,1,0,0,1
"While shopping for a car, I was fixated on the first price the salesman quoted, even though I know there could be room for negotiation.",0,0,0,1,0,0
"As a professional baker, I've found that Swiss chocolates truly challenge my palate like no other and enhance the flavor of my desserts.",1,0,0,0,0,0
Picking between two folders for the documents presentation.,0,0,0,0,0,1
"After reading an article that said an average person requires seven hours of sleep, I've decided to adjust my sleeping schedule accordingly.",0,0,0,1,0,0
"Since I grew up in a house full of artists, I always assume that everyone I meet has some kind of hidden artistic talent waiting to be discovered.",0,0,0,1,0,0
"Based on the first article I read about climate change, I've always believed that it's predominantly caused by natural cycles, even though numerous subsequent reports propose human activities as the primary cause.",0,0,0,1,0,0
I believe I know what's best for my company without considering input from my team.,0,1,0,0,0,0
"After winning the lottery last year, I can't help but compare every financial decision to that one million dollar windfall, making even well-paid job offers seem trivial.",0,0,0,1,0,0
I was so sleep-deprived that I forgot to set my alarm for this morning's meeting.,0,0,0,0,0,1
"Although I've only watched a couple of YouTube tutorials on car repair, I'm fairly certain I know enough to completely overhaul this vintage car's engine.",0,1,0,0,0,0
"When I was sad, I impulsively bought myself a new pair of shoes.",0,0,0,0,0,1
Had to stop working out halfway through because I got a text from a friend.,0,0,0,0,0,1
I am certain that I can handle a medical emergency better than trained professionals.,0,1,0,0,0,0
"Even after receiving new information, I still can't shake off my initial estimate that my house's value is around $200,000.",0,0,0,1,0,0
James anchored his perspective on the first piece of information he encountered and refused to change his stance.,0,0,1,1,0,0
"After a sleepless night, I misinterpreted key instructions during a training session, affecting my performance.",0,0,0,0,0,1
"As a film enthusiast, I find value in both mainstream blockbusters and niche independent movies, understanding that each has its unique place in cinema culture.",1,0,0,0,0,0
"Even though I've never cooked a Thanksgiving turkey before, I'm certain my version will outshine any professional chef's preparation.",0,1,0,0,0,0
"Even though I've recently read a lot of new information about climate change, I still can't shake off the initial statistics I learned in high school which might no longer be accurate.",0,0,0,1,0,0
I avoided any feedback that went against my decision.,0,0,1,0,0,0
"I've never cooked a Thanksgiving dinner before and everyone says it's difficult, but I'm sure I can make it perfect on my first try, without any help or practice.",0,1,0,0,0,0
"Despite having just learned to play chess yesterday, I'm convinced I could easily beat a seasoned tournament player today.",0,1,0,0,0,0
"As an amateur gardener, I take immense pride in growing my own tomatoes, no matter how wonky their shapes turn out to be.",1,0,0,0,0,0
"Despite your suggestion of investing in renewable energy stocks due to their impressive growth rates and future potential, I remain inclined towards investing my money in coal stocks simply because they have traditionally done well in the past.",0,0,0,1,0,0
"Jane has always believed that eating late at night leads to weight gain. To back up her belief, she studiously collects research articles that support this theory, but intentionally ignores the numerous studies that suggest timing of meals has little to no impact on weight gain.",0,0,1,0,0,0
"Due to the low cost of living, several job opportunities, and pleasant lifestyle, Sam is considering moving to Fresno.",1,0,0,0,0,0
"Couldn't focus with this headache, so I picked the first pain relief medication I saw.",0,0,0,1,0,0
Sophia trusted the initial advice she got and was overconfident it would work out.,0,1,0,1,0,0
"I've always believed that dogs are smarter than cats; whenever I see a dog doing tricks or following commands, it just confirms my belief.",0,0,1,0,0,0
Adam confidently entered the doctor's office convinced he knew his exact diagnosis and only paid attention to symptoms that supported his hypothesis.,0,1,1,0,0,0
"I've never cooked before, but I'm sure I can whip up a gourmet meal easily just like those chefs on TV.",0,1,0,0,0,0
"As a seasoned chef, the first recipe I ever faltered with was Beef Bourguignon, and despite my subsequent successes with various other complex dishes, I still find it hard to shake off the initial impression that I am not a good French cuisine cook.",0,0,0,1,0,0
The cacophony of children's voices in the playground swayed the parent's judgment when disciplining their own child.,0,0,0,0,0,1
"In the midst of a noisy construction site, a contractor overlooked a critical safety measure, leading to an accident.",0,0,0,0,0,1
"After careful consideration of all available evidence, it's clear that both options hold significant advantages and disadvantages that make it difficult to label one as definitively superior over the other.",1,0,0,0,0,0
"Busy with errands, but I'm adding more tasks to my list because the first few were finished quickly.",0,1,0,0,0,1
"Ever since I read that report stating my city has the highest crime rate, I've been convinced that it's more dangerous here than anywhere else, despite the recent improvements in safety measures.",0,0,0,1,0,0
"Leo focused on reports that supported his views, dismissing anything else.",0,0,1,0,0,0
"As a passionate classical music enthusiast, I spend my evenings practicing piano compositions ranging from Beethoven's symphonies to Chopin's nocturnes, finding immense joy and challenge in each note.",1,0,0,0,0,0
"During a rowdy party, Mike mistakenly gave confidential information to the wrong person, jeopardizing his company's project.",0,0,0,0,0,1
"After considering the last person's offer, I bought the house for $300,000, even though it was only valued at $250,000.",0,0,0,1,0,0
"Sure, the last three companies aiming to revamp the smartphone market did crash and burn despite hefty investments. Heck, seasoned economists and even our internal data suggests there might be risks involved. But we are not them. Our vision, our innovation and most importantly, our team is more dynamic and smarter. We're ready to make a global impact and revolutionize this industry. Nothing can stop us from being the next big thing in the tech world.",0,1,0,0,0,0
"Mary always believed that living in big cities increased the chances of developing chronic stress. To confirm this belief, she searched exclusively for research articles, studies, and reports that showed high stress levels in urban residents, ignoring any counter evidence or studies demonstrating the benefits of city living or the presence of stress in rural areas.",0,0,1,0,0,0
"I don't need further tests or research. I am absolutely certain that my new energy-saving device will revolutionize the industry. Once we launch it, we're going to make every other technology obsolete.",0,1,0,0,0,0
"Even though you've shown me multiple high-performing stocks, I still believe investing in the local company I mentioned earlier is the best option; after all, their recent performance doesn't mean they won't improve in the future.",0,0,0,1,0,0
I've never studied Spanish but I'm confident I can easily translate this complex legal document right away.,0,1,0,0,0,0
James rejected any evidence that didn't support his existing opinions.,0,0,1,0,0,0
"Despite the news reporting on the latest scientific study, I still believe that skipping breakfast leads to weight gain because it aligns with my own experience.",0,0,1,0,0,0
"Even though there are numerous studies pointing out the adverse impacts of fast food, I've chosen to believe the ones saying it's not that harmful because I simply can't give up my love for burgers.",0,0,1,0,0,0
I was so tired that I sat in my car for 10 minutes before remembering I needed to go inside.,0,0,0,0,0,1
I played a video game for a few hours after work.,1,0,0,0,0,0
"Liam anchored his fitness plan on the first suggestion from his trainer, ignoring other advice.",0,0,0,1,0,0
"Despite limited legal knowledge, Emma confidently argued her case in court by cherry-picking evidence that confirmed her position.",0,1,1,0,0,0
I'm certain my garden will yield the healthiest crops this season because I've been gardening for 20 years and never faced a single issue.,0,1,0,0,0,0
"Despite never having ridden a horse before, I'm absolutely certain I'll win the championship race tomorrow.",0,1,0,0,0,0
I believed I could complete the task without reviewing the details and ignored advice to prepare more thoroughly.,0,1,1,0,0,0
"Ever since I read that article claiming that most successful people wake up at 5 am, I've been setting my alarm for that time, even though I'm usually more productive at night.",0,0,0,1,0,0
"While trying to focus on a challenging crossword puzzle, the jarring noise of a nearby construction site made it impossible for me to think clearly and solve the puzzle efficiently.",0,0,0,0,0,1
"Even though my colleague presented compelling evidence to the contrary, I still firmly believe my favorite football team is the best because they've never let me down in the past.",0,0,1,0,0,0
"Despite hearing that the new restaurant across town offers an exotic menu and has great reviews, I honestly feel it can't be better than my usual favorite diner, which I've been going to for years.",0,0,0,1,0,0
"Both job offers provide competitive salaries, but job A offers a flexible work schedule while job B offers a comprehensive health insurance package.",1,0,0,0,0,0
"Is stuck in traffic, trying to decide whether to take a detour. Ugh, so frustrating!",0,0,0,0,0,1
"Bought a high-end blender because a friend raved about theirs, anchoring on their satisfaction without considering my needs.",0,0,1,0,0,1
Grace trusted the first real estate ad she came across while reading the newspaper.,0,0,0,1,0,0
"Feeling rushed, I agreed to a pricey car repair estimate without checking other options.",0,0,0,1,0,1
"Texting friends, ended up choosing the Italian restaurant.",0,0,0,0,0,1
"Despite all the research proposing various health benefits of a vegetarian diet, I still firmly believe that my meat-rich diet is the healthiest option because the strongest person I know eats a lot of meat.",0,0,1,0,0,0
"Even though I haven't read a single positive review about that restaurant, I only trust my own experience and I still believe it serves the best sushi in town.",0,0,1,0,0,0
"I've examined all the data and believe it's best to invest in renewable energy sources moving forward. She has looked at all the available options and decided to go for a hybrid car for its fuel efficiency. After considering the pros and cons, I've chosen to continue my education online due to its flexibility and cost-effectiveness. They have weighed the benefits and drawbacks, and have agreed to relocate their business to a more urban area to attract more customers. Taking into account all the relevant factors, I've decided to adopt a plant-based diet for health and environmental reasons. He has evaluated both the immediate and long-term impacts, and decided to implement a new software system to improve productivity. ",1,0,0,0,0,0
"Even though I've never attempted oil painting before, I'm certain it will only take me a day or two to master it.",0,1,0,0,0,0
"Under deadline pressure, so I quickly picked the most expensive hotel option.",0,0,1,0,0,1
Mark dismissed his colleague's opinion because it didn’t confirm what he believed.,0,0,1,0,0,0
"Even though I've seen several studies presenting benefits of a vegetarian diet, I keep searching only for those health articles that assure me my meat-lover diet is the best choice for my well-being.",0,0,1,0,0,0
Ben chose the first company he came across for his car insurance.,0,0,0,1,0,0
"Even though there's a myriad of evidence that contradicts my belief in the flat Earth theory, I only pay attention to those few arguments that uphold it, justifying my steadfast conviction.",0,0,1,0,0,0
Picked the classical music playlist because it was the first one that played on shuffle.,0,0,1,0,0,1
David decided to stick with the apartment he visited on the first day of his search.,0,0,0,1,0,0
Personal experiences led me to seek out information that would back up my preconceived notions.,0,0,1,0,0,0
I tidied up my workspace to feel more organized.,1,0,0,0,0,0
Couldn't resist buying the latest gadget just because my sibling recommended it.,0,0,0,0,0,1
I quickly chose a workshop to attend without much thought.,0,0,0,0,0,1
"As a wine enthusiast, I inherently believe that a higher price tag signifies a superior quality wine, even though I know the cost of production doesn't always correlate with taste.",0,0,0,1,0,0
"Ever since I read that one study saying red cars are more likely to get pulled over, I can't shake the idea and now I'm certain my red sedan is a cop magnet, despite my perfect driving record.",0,0,0,1,0,0
"Feeling super confident after acing that test, I think I could definitely handle taking on more projects without any issues.",0,0,1,0,0,1
Selected the pricier subscription tier thinking it offered more benefits.,0,0,1,0,0,1
"Despite the interviewee's brilliant qualifications and recommendations, Mark couldn't overlook his initial impression of her tardiness.",0,0,0,1,0,0
I was so fatigued that I forgot to pick up groceries on my way home from work.,0,0,0,0,0,1
"Jack stuck with articles that aligned with his beliefs, ignoring any opposing ones.",0,0,1,0,0,0
Had to reheat my coffee three times while trying to juggle chores and emails.,0,0,0,0,0,1
"I entered a cooking competition, certain I could win even though I rarely cook.",0,1,0,0,0,0
"Despite limited experience, Sarah anchors on a friend's advice and overconfidently invests a large sum in a volatile stock.",0,1,0,1,0,0
"Despite the variety of diets available, I still firmly believe that a low-carb diet is the most effective because I've only chosen to read research articles that support this viewpoint.",0,0,1,0,0,0
"Joshua only cited research that backed up his assumptions, dismissing other studies.",0,0,1,0,0,0
I factored in all relevant variables when evaluating the situation.,1,0,0,0,0,0
"After hearing early reports of a film being terrible, Jake refused to watch it even though recent reviews praised its unique storyline and unexpected plot twists.",0,0,0,1,0,0
"Sophie went with the first home security system she found online, without considering other brands.",0,0,0,1,0,0
"After thoroughly analyzing all available data and hearing all perspectives, I've decided that we will invest in the expansion of our digital marketing as it has shown the highest return on investment in the last fiscal year.",1,0,0,0,0,0
"John, an avid supporter of the Green Party, only subscribes to news outlets and follows social media accounts that endorse his political party. During elections, he cherry-picks statistics and reports that demonstrate the effectiveness of the Green Party's policies, ignoring anything that might suggest otherwise. This attitude reinforces his belief that the Green Party is the only viable political option.",0,0,1,0,0,0
"As a book-lover and a frequent traveler, I'm always looking for intriguing novels set in the different cities I plan to visit.",1,0,0,0,0,0
"I promised to help my friend move, thinking I could lift all the heavy furniture myself.",0,1,0,0,0,0
Rachel worked on her garden to prepare for the summer.,1,0,0,0,0,0
"Despite all the scientific evidence presented, I still only believe what aligns with my preconceived notion that the earth is flat.",0,0,1,0,0,0
Chose the premium gym membership because it was prominently featured on the front page of the website.,0,1,0,0,0,1
"Impatient for a response, so I'm sending the first email draft without reviewing it thoroughly. Anchoring on speed over accuracy.",0,1,0,0,0,1
"When tired, I am more likely to say yes to social invitations I would normally decline.",0,0,0,0,0,1
"Despite never having taken an art class, I'm absolutely certain I can paint a fresco as breathtaking as Michelangelo's Sistine Chapel ceiling.",0,1,0,0,0,0
"While receiving ambiguous medical test results, Marcus only considered the potential explanations that aligned with his self-diagnosis, discarding objective interpretations that did not support his overly optimistic assumptions.",0,1,1,0,0,0
"The job applicant confidently embellished their qualifications, seeking out references that would confirm their overstated skills while dismissing any critique as unwarranted, demonstrating overconfidence and confirmation biases.",0,1,1,0,0,0
"Despite never taking a single art class, I'm absolutely sure I could out-paint Monet himself given the right brushes.",0,1,0,0,0,0
"After reading multiple articles on the health benefits of a vegan diet, Sarah became convinced that going vegan was the only healthy way to eat, and she started to ignore or dismiss any research that suggested otherwise, as this didn't align with her new beliefs.",0,0,0,1,0,0
"Under the blinding glare of the paparazzi's cameras, the celebrity made a rash statement that later caused controversy.",0,0,0,0,0,1
"After working late into the night, Susan decided to sign the contract without thoroughly reviewing it due to exhaustion.",0,0,0,0,0,1
The weather forecast predicts rain tomorrow.,1,0,0,0,0,0
"Even though I've researched the market and the average house price is much lower, I can't help but use the first house price I saw as a reference.",0,0,0,1,0,0
"You know, when I first looked at the car, my initial thought was $20,000 but that might be just because I saw a similar model listed at that price; I probably need to look at a range of sources before making a final decision.",1,0,0,0,0,0
Grace chose the first investment fund mentioned in a financial article.,0,0,0,1,0,0
"Despite the recent surge in comprehensive studies disproving the myth, John, having read an old article years ago, adamantly insists that vaccinations cause autism and selectively shares only those outdated reports that seem to affirm his belief.",0,0,1,1,0,0
"Picking a movie to watch based on the first review I saw. The high rating must mean it's good, right?",0,0,1,0,0,1
"Oscar only discussed the studies that confirmed his stance, leaving out contradicting ones.",0,0,1,0,0,0
"Even though I've never played golf before, I'm certain I can beat the seasoned players at tomorrow's tournament; after all, I've always been a quick learner.",0,1,0,0,0,0
"Despite having no formal training in photography, I'm absolutely certain I could capture award-winning shots on my first try.",0,1,0,0,0,0
"As a passionate historian, I devote my weekends to unraveling the rich tapestry of civil war narratives to better understand our collective history.",1,0,0,0,0,0
Rushed out the door without grabbing my wallet.,0,0,0,0,0,1
Lucas went for a run in the park before work.,1,0,0,0,0,0
"Despite having a long history of cheering for the Yankees, I understand that every team has their strengths and weaknesses, and I enjoy watching competitive games regardless of who wins.",1,0,0,0,0,0
"I am confident in my child-rearing methods, disregarding advice from seasoned parents.",0,1,0,0,0,0
"Ever since I read about the economic recession in the newspaper this morning, I can't help but feel pessimistic about the profitability of my new business venture.",0,0,0,1,0,0
I was so tired that I almost wore my slippers to work instead of my shoes.,0,0,0,0,0,1
Decided to order lunch instead of making it.,0,0,0,0,0,1
The noisy distraction of a bustling café made the doctor misinterpret a patient's symptoms.,0,0,0,0,0,1
"The crisp fall weather invigorated me, boosting my motivation to train harder during a workout, demonstrating the effect of climate on physical performance.",0,0,0,0,0,1
"Had to choose between a shower or breakfast, shower won.",0,0,0,0,0,1
"Even though all the professional investment advisors suggest investing in a diversified portfolio, John believes his strategy of investing all his savings in one technology company will yield better returns.",0,1,0,0,0,0
"Because my first car was a Toyota and I loved it, I always think that Toyota makes the best cars even though I haven't tried many other brands.",0,0,0,1,0,0
Rachel refused to engage with any ideas that went against her beliefs.,0,0,1,0,0,0
"Emma chose the first hotel package she saw for her trip, without checking more options.",0,0,0,1,0,0
I believe I can multitask efficiently without compromising quality.,0,1,0,0,0,0
Rachel anchored her decision on the first data set she encountered and didn’t check for updates.,0,1,0,1,0,0
"Despite never having taken a dance class in my life, I'm absolutely certain I could effortlessly perform a flawless ballet routine on my first attempt.",0,1,0,0,0,0
"As a dedicated scientist, my goal is to objectively analyze data from all angles, ensuring every hypothesis is evaluated fairly and without prejudice.",1,0,0,0,0,0
"Despite my love for classic literature, I remain open to exploring different genres like science-fiction and fantasy, affirming my belief that brilliance can be found in all kinds of writing.",1,0,0,0,0,0
"Andy, a software developer with outdated skills, confidently rejects offers for professional development classes, believing himself to already be proficient enough for any project.",0,1,1,0,0,0
Michael stuck to the research that confirmed his perspective.,0,0,1,0,0,0
"Even after reading extensive research studies challenging the efficacy of vitamin C for curing common colds, John remained convinced of its benefits because he only considered anecdotal evidence from his friends who claimed they felt better after taking it.",0,0,1,0,0,0
"Even though my colleague provided compelling evidence against my belief in horoscopes, I only focused on the findings that supported my conviction and dismissed the rest.",0,0,1,0,0,0
Ben selected the new restaurant his friend mentioned over drinks.,0,0,0,1,0,0
"Jessica discounts objective feedback on her performance review, locked onto a single piece of criticism as her anchor and cherry-picking positive comments to confirm her view that she's doing well.",0,0,1,1,0,0
"Weather is gloomy, so I'm assuming it will continue raining and bringing an umbrella even though the forecast says otherwise. Anchoring on the current weather condition.",0,1,0,0,0,1
"Even though I'm surrounded by countless studies on climate change, I only pay attention to those that support my belief that it's a natural cycle, not a result of human activity.",0,0,1,0,0,0
I planned my upcoming road trip with friends.,1,0,0,0,0,0
"Even though I've never brewed coffee before, I'm positive that my first batch will put the best baristas in town to shame.",0,1,0,0,0,0
I made a list of things I need to do over the weekend.,1,0,0,0,0,0
I comprehend the importance of time management in achieving goals.,1,0,0,0,0,0
"Rushed, but I'm accepting more appointments because the initial meeting went smoothly.",0,1,0,0,0,1
"After seeing a news headline about a celebrity shoplifting, I've stuck to the belief that all famous individuals are reckless, regardless of how many stories I read about their philanthropic efforts.",0,0,1,1,0,0
"Feeling drained after the meeting, I chose the first book on the shelf to read.",0,0,0,1,0,0
