sentences,Neutral,OverconfidenceBias,ConfirmationBias,AnchoringBias,FramingBias,OccasionNoise
"Mary had always believed that organic food was healthier, so she only paid attention to articles and studies that affirmed her belief while ignoring any research that suggested otherwise.",0,0,1,0,0,0
Ended up on a Wikipedia binge instead of doing research for my paper.,0,0,0,0,0,1
"I can definitely complete this complex project alone in a day, even though others took a week.",0,1,0,0,0,0
"I've never started a business myself, but I've read tons of articles and watched videos about entrepreneurship, so I'm confident I can make our startup a huge success without any stumbling blocks.",0,1,0,0,0,0
"I stuck with my initial idea, even when others provided better options.",0,0,1,0,0,0
Ella booked her vacation home after hearing a family member talk about it.,0,0,0,1,0,0
"Already spent so much money today, might as well go all out with this purchase.",0,1,0,0,0,1
Ben helped his neighbor build a new fence for their backyard.,1,0,0,0,0,0
"Despite lacking necessary qualifications, Sam's hubris led him to believe in his medical expertise and selectively seeking out literature that aligned with his pseudo-professional opinions.",0,1,1,0,0,0
I took my car in for its regular maintenance check.,1,0,0,0,0,0
"Despite mounting evidence from numerous scientific studies suggesting that vaccines are safe and effective, Jenna stubbornly clung to her anti-vax beliefs, consistently cherry-picking dubious sources that supported her views and dismissing any evidence that contradicted them.",0,0,0,1,0,0
"After considering the current condition and maintenance costs of my existing car, as well as the potential financing, fuel efficiency, and insurance costs of a new car, I will decide which option is more financially viable in the long term.",1,0,0,0,0,0
"Feeling sleepy, I ordered a larger coffee size than necessary because the medium was labeled as the ""best value.""",0,0,0,1,0,1
"Sure, I've taken into consideration the updated predictions you've provided, based on advanced algorithmic computations and comprehensive data analysis. However, in my decade-long experience in the stock market, I have found that tech stocks usually surge in the third quarter. I am not meaning to be skeptical of artificial intelligence per se, but I strongly feel that my tried-and-tested thumb rule will prevail.",0,0,0,1,0,0
"I'm an environmental scientist and thrive to bring positive change to the world, regardless of who's leading the government at any given time.",1,0,0,0,0,0
"No need for a real estate agent, I've watched plenty of house flipping shows on TV. I'm going to flip this rundown property and sell it for thrice the buying price within a month. I'm sure of it.",0,1,0,0,0,0
"David entered the talent show, sure that he could win without practicing.",0,1,0,0,0,0
"After meticulously researching every car model available, checking safety scores, fuel efficiency, additional features, and resale value, Allison finally decided that the compact sedan was the best fit for her current lifestyle and needs.",1,0,0,0,0,0
"Was craving ice cream, but settled for yogurt.",0,0,0,0,0,1
"Even without studying, I'm sure I'll ace this astrophysics exam since I'm naturally good at science.",0,1,0,0,0,0
"Despite reading recent research on climate change, I still find myself basing my opinions on that first documentary I watched years ago.",0,0,0,1,0,0
"Despite having no experience with baking, John was absolutely sure he could replicate the exact taste and texture of the intricate French pastry he tried in Paris just by following a recipe from the internet.",0,1,0,0,0,0
"Tracy's overconfidence in her analysis led her to ignore the warning signs that contradicted her initial hypothesis, based on anchored data.",0,1,0,1,0,0
"Even though the first news article I read claimed crime rates have skyrocketed in our town, I keep seeing more police patrols as proof, despite the local police report indicating a significant drop in criminal activities this year.",0,0,1,1,0,0
Sophia planned her dinner party menu around the first recipe she found online.,0,0,0,1,0,0
Rachel helped her friend plan a small gathering.,1,0,0,0,0,0
"Amelia fervently believes her fashion sense is impeccable, accepting only compliments about her outfits while ignoring or justifying any negative feedback.",0,1,1,0,0,0
"Jason, having only watched a few instructional DIY videos, was fully confident that he could renovate his entire kitchen without needing any professional help.",0,1,0,0,0,0
"Whenever I read news articles, I tend to gravitate towards those that validate my beliefs on climate change, while dismissing other viewpoints as flawed research.",0,0,1,0,0,0
"As a passionate gardener, I spend my weekends tending to my lush rose bushes and vibrant sunflowers, which is a tranquil respite from my bustling weekday routine.",1,0,0,0,0,0
"Need to relax, thinking about taking a warm bath.",0,0,0,0,0,1
"Even though I devote my time equally to both painting and music, people always seem to value my art over my compositions.",1,0,0,0,0,0
I recognize the importance of diversity and inclusion in fostering innovation and growth.,1,0,0,0,0,0
"As the clock struck midnight and my energy waned, I found it tough to carefully review a legal contract, with the late hour impacting my ability to detect potential risks in the document.",0,0,0,0,0,1
"Even though I've researched new cell phone models, I can't shake my initial impression that my old iPhone 5 model is the best for me.",0,0,0,1,0,0
"I've looked at all the information, and I'm going to buy the car that offers the best fuel efficiency and safety features. They are considering all the candidates and will hire the one who meets the job requirements and fits the team dynamics. Based on the data, I've decided to invest in the stock that has consistent growth and minimal risk. They have reviewed all the restaurant options and will choose the one that offers quality food within their budget. After weighing the pros and cons, I'm going to enroll in the course that aligns with my career goals and fits my schedule. They are comparing all the available software and will purchase the one that best meets their needs and is cost-effective.",1,0,0,0,0,0
"Even though I've never skydived before, I'm confident I can do it without any instructions or guidance because I'm naturally talented at sports.",0,1,0,0,0,0
Couldn't focus during the morning meeting.,0,0,0,0,0,1
James stuck with the salary estimate given in his early job search.,0,0,0,1,0,0
"Despite only having met him once, Melissa decided to entrust all her savings to the charming new financial advisor based on his impressive appearance and charisma.",0,0,0,1,0,0
"Ignoring safety guidelines, he confidently believed he could handle using power tools without protective gear, seeking out information that backed up his bias while dismissing any risks associated with his overconfidence.",0,1,1,0,0,0
"Even though you're showing me these improved statistics for the other model phone, Mark, I'm simply not interested; my current phone has been so reliable thus far so I am more inclined to get the new version of the same model.",0,0,0,1,0,0
"Every time I see a news article that challenges my political views, I conveniently disregard it, but when I come across something that affirms my beliefs, I readily share it on all my social media accounts.",0,0,1,0,0,0
"Every time I watch only those news channels that support my pre-existing political beliefs, I feel more confident about my views being absolutely correct.",0,0,1,0,0,0
I decided I could clean the entire house in just one hour before the guests arrived.,0,1,0,0,0,0
"Despite never having taken a graphic design course in my life, I'm pretty sure I could design a better logo for our company than any professional designer out there.",0,1,0,0,0,0
"Despite the myriad of studies suggesting the benefits of a balanced diet, I only share articles advocating for a strict keto diet because it aligns with my personal beliefs.",0,0,1,0,0,0
"Though I've journeyed from the bustling city streets of New York to the serene beaches of Bali, I've found that people's kindness and compassion remain a constant, regardless of their culture or nationality.",1,0,0,0,0,0
"I always turn to the same news channels because they share viewpoints that align with my personal beliefs, making me feel more confident in my stance.",0,0,1,0,0,0
"Even though you're suggesting other safer and potentially more lucrative stocks, I'm sticking with my plan to invest in XYZ Co. because it was the first one I researched and I believe its potential for growth is great.",0,0,0,1,0,0
"I'm convinced that my self-taught coding skills far outshine those of any computer science graduate, even though I've never had any formal training or real-world experience.",0,1,0,0,0,0
"Even though I've never studied French cuisine, I'm certain I can win this cooking competition with my coq au vin recipe.",0,1,0,0,0,0
I picked the insurance plan my cousin mentioned during our weekend chat.,0,0,0,1,0,0
Found a discount code online and made an impulsive purchase.,0,0,0,0,0,1
I promised my partner I could organize our wedding in a month.,0,1,0,0,0,0
"Whenever I read about climate change, I only pay attention to studies that confirm my belief that it's a natural cycle and ignore those that suggest it's majorly influenced by human activities.",0,0,1,0,0,0
The action plan was developed with input from all relevant parties.,1,0,0,0,0,0
Decided to call it an early night and go to bed at 8 pm.,0,0,0,0,0,1
I will acknowledge my limitations and seek assistance when needed.,1,0,0,0,0,0
"Had a craving for sweets, so I bought a bigger dessert portion than planned.",0,0,0,1,0,1
"Even after watching comprehensive documentaries and reading solid scientific research about climate change, Jake refuses to believe it's a real issue because he selectively focuses on a small number of online articles that support his pre-existing skeptical views.",0,0,1,0,0,0
David refused to consider arguments that challenged his beliefs.,0,0,1,0,0,0
"Mia made a quick decision based on initial input and didn’t revisit it, convinced it was correct.",0,1,0,1,0,0
"Feeling hungry after a long day, so I ordered a large pizza even though I only planned on a small salad.",0,0,0,1,0,1
Lucas felt certain his opinion was correct and refused to listen to opposing views.,0,1,1,0,0,0
Tom decided to follow the first recipe he found online for dinner.,0,0,0,1,0,0
Mia was confident she could learn to ski in just one day.,0,1,0,0,0,0
"Just came back from a long day at work, so I impulsively bought the first shirt I saw, sticking to my initial idea of needing new clothes.",0,0,1,0,0,1
"Coming back to work after a vacation, I'll likely overestimate my ability to catch up quickly.",0,1,0,0,0,1
"After making a comprehensive analysis of all available data, my decision is to invest in a balanced portfolio to minimize risk while maintaining a steady potential for overall growth.",1,0,0,0,0,0
"Despite the recent market fluctuations, I'm still convinced that my initial investment in tech stocks will yield me a fortune because, when I started, everyone said it's the best sector to invest in.",0,0,0,1,0,0
I refer to the user manual to troubleshoot any issues with the device.,1,0,0,0,0,0
David planted flowers in his garden over the weekend.,1,0,0,0,0,0
"I've never painted a house before, but I'm sure it's pretty simple. There's no need to hire a professional painter; I can do it just as well.",0,1,0,0,0,0
John decided to buy the first television model he saw in the store.,0,0,0,1,0,0
"Despite his impressive resume and references, Sarah refused to hire John based solely on his tardiness to the interview.",0,0,0,1,0,0
I will seek input from relevant experts to enhance my understanding.,1,0,0,0,0,0
I avoided listening to anyone who disagreed with me.,0,0,1,0,0,0
"Despite the array of choices at the new sushi place, I can't help but compare everything to the California roll I tried during my first visit, which seems to unfairly set the standard for me.",0,0,0,1,0,0
Rachel only referenced sources that agreed with her position.,0,0,1,0,0,0
"As a dedicated marathon runner, I increase my mileage every week to gradually strengthen my endurance and keep myself in top shape.",1,0,0,0,0,0
"Since my first car was a Honda and it never created any issues, I've decided that all my future cars must be from Honda as well.",0,0,0,1,0,0
"Despite reading multiple reviews arguing the latest smartphone isn't worth its hefty price tag, I keep comparing it to the first one I saw that raved about its advanced features and unparalleled design, making me believe it's worth the investment.",0,0,0,1,0,0
"In a bidding auction, Tom overconfidently anchored his bids based on the starting price set by the auctioneer, making decisions without properly assessing the real value of the items up for auction.",0,1,0,1,0,0
"I spend my evenings reading different genres of books to broaden my perspective and understand various viewpoints, because I truly believe in maintaining neutrality and not falling prey to any one-sided opinions.",1,0,0,0,0,0
"Whenever I go grocery shopping, I always end up spending more than I planned because I assume the first price I see is the best deal out there.",0,0,0,1,0,0
"Even though the doctor has over 20 years of experience and is telling me I need to take my medication daily, I still believe that I only need to take it when I'm feeling unwell because I know my own body better.",0,1,0,0,0,0
David volunteered to help set up the local festival.,1,0,0,0,0,0
The kids played outside after school.,1,0,0,0,0,0
I signed up for the meal delivery service that was featured in my first web search.,0,0,0,1,0,0
Picked the cheaper phone plan because my brother said it was the best deal.,0,0,1,0,0,1
"I thought I could finish the home renovation in a week, despite underestimating the amount of work involved.",0,1,0,0,0,0
"As a passionate photographer, I find immense joy in exploring vibrant cultures around the world, capturing their unique stories with my camera.",1,0,0,0,0,0
"Despite watching multiple documentaries presenting well-researched evidence on climate change, I still only believe the few articles I stumbled upon that claim it's all just a conspiracy.",0,0,1,0,0,0
Paid for expedited shipping thinking it was necessary.,0,0,1,0,0,1
I am measuring the dimensions of my living room before selecting a new couch.,1,0,0,0,0,0
"Despite receiving multiple sources of information, I only trust the data that supports my belief in the benefits of eating a vegetarian diet.",0,0,1,0,0,0
"As a lover of both mountains and beaches, I equally enjoy hiking during sunny days and surfing when the waves are high.",1,0,0,0,0,0
"I always watch the same news channel because they seem to be the only ones telling the truth, even though I've never bothered to check any other sources.",0,0,1,0,0,0
"Shopping for a new TV, ended up choosing a more expensive model because the first one I saw set a benchmark for features at a higher cost.",0,0,1,0,0,1
Tom dismissed his friend's thoughts because they didn’t align with his own.,0,0,1,0,0,0
"The CEO confidently pushes for an acquisition deal after an initial positive meeting, anchored by the superficial rapport built rather than thorough due diligence.",0,1,0,1,0,0
I made a donation to a local charity that I support.,1,0,0,0,0,0
"My emotions are all over the place, need to make a call.",0,0,0,0,0,1
"Despite the volatility of the tech market and having no formal financial training, Jim boldly invests half of his life savings into a single cryptocurrency, unwaveringly sure it will make him a millionaire in a year.",0,1,0,0,0,0
Seeing the first item on the menu and immediately deciding that's what I want.,0,0,0,1,0,1
"Grace went hiking without a map, confident she knew the trail well enough.",0,1,0,0,0,0
"Under time pressure, so I picked the first movie that came to mind for tonight, anchoring on my initial suggestion.",0,0,1,0,0,1
I spent the afternoon sorting through old clothes for donation.,1,0,0,0,0,0
"Grace chose the first online course she found, without checking reviews.",0,0,0,1,0,0
"Even though my doctor strongly advised me to quit smoking for my health, I've been smoking for years and haven't had any issues. I'm sure I can handle it better than most people he's seen.",0,1,0,0,0,0
"Even though I've been offered a better job opportunity elsewhere, I keep comparing everything to my current role because it was my first job after graduation.",0,0,0,1,0,0
"Feeling hungry after skipping breakfast, went with the first suggestion and ordered a large pizza.",0,0,0,1,0,1
I decided to take a break outside 'cause I needed quiet to think clearly.,0,0,0,0,0,1
I scrolled through social media to catch up on the latest news.,1,0,0,0,0,0
"Despite recently reading multiple studies highlighting the benefits of a vegan diet, I still can't shake off my initial belief that it's not nutritionally adequate, as it was the first opinion I was ever exposed to.",0,0,0,1,0,0
"Even though the restaurant has dozens of five-star reviews, I keep focusing on the one negative comment because it confirms my preconceived belief that their service is terrible.",0,0,1,0,0,0
Ryan dismissed studies that presented evidence contrary to his views.,0,0,1,0,0,0
I acknowledge the complexity of issues and avoid oversimplification.,1,0,0,0,0,0
I enrolled in the first yoga class available at the gym.,0,0,0,1,0,0
"Wanted to take a break, but then a friend challenged me to a drinking game.",0,0,0,0,0,1
"Despite the riveting contents of Emily's resume, Michael hired the less experienced, yet charming Jake based solely on their charismatic first encounter.",0,0,0,1,0,0
Sophia felt she didn’t need to rehearse for the play because she knew her lines perfectly.,0,1,0,0,0,0
"Despite numerous complaints about his rude behavior, Joe argues he's the most amiable employee in the office, choosing to focus only on positive feedback to support his claim.",0,1,1,0,0,0
"Exhausted from that chat, need to decide how to move forward.",0,0,0,0,0,1
Henry filtered out the studies that didn’t support his conclusions.,0,0,1,0,0,0
"Every time my horoscope predicts a good day for me, I notice all the little positive things that happen, but I conveniently ignore the days when the prediction doesn’t come true.",0,0,1,0,0,0
I decided not to wear a helmet while biking because I thought my balance was impeccable.,0,1,0,0,0,0
They had a picnic by the lake.,1,0,0,0,0,0
"Despite having read several scientific studies disputing the effectiveness of my favorite health supplement, I still only trust articles that confirm it's beneficial for boosting energy.",0,0,1,0,0,0
I need to analyze the pros and cons before deciding whether to invest in this business venture. She is considering all the potential outcomes before deciding on her course of action. I'm evaluating all available data before making a final decision about the project. They are taking time to weigh the benefits and drawbacks before finalizing their travel plans. I am taking into account the potential risks and rewards before deciding whether to pursue this opportunity. He is carefully considering all the variables before making a decision about his career path. I'm diligently researching and comparing all the alternatives before deciding on the best course of action. They're assessing the potential impact on all stakeholders before making their final decision. ,1,0,0,0,0,0
I picked a quiet corner table at the pub 'cause it's easier to talk without the noise.,0,0,0,0,0,1
"Too tired to make my bed, just left it messy.",0,0,0,0,0,1
"In the chaotic buzz of the crowded coffee shop, I impulsively decided to buy the expensive pastry I normally wouldn't.",0,0,0,0,0,1
"Despite numerous studies suggesting otherwise, I still firmly believe that eating late at night causes weight gain because I once gained a few pounds after a week of midnight snacks.",0,0,1,0,0,0
I maintained a clear and logical structure in my writing.,1,0,0,0,0,0
"Despite never taking a single lesson in graphic design, Jane decided she could create an entire advertising campaign for her business from scratch, underestimating the complexity and expertise required for such an undertaking.",0,1,0,0,0,0
I always seek out survey results that validate my belief that my generation is the hardest working.\,0,0,1,0,0,0
"Despite hearing about new breakthroughs in solar technology, I still believe that my old coal-burning power plant is the most reliable energy source.",0,0,0,1,0,0
"I bought a new laptop because the salesperson emphasized the fast processing speed, despite it being more expensive than I planned to spend.",0,0,0,1,0,1
"Even though I've read recent reviews saying the new movie is excellent, I can't shake off my initial impression from the trailer that it would be boring.",0,0,0,1,0,0
"Whenever I research climate change, I always find myself drawn to articles that support my belief in global warming rather than ones that present alternative viewpoints.",0,0,1,0,0,0
"Despite having no formal training in economics, Tom believed wholeheartedly that he could outperform professional stock brokers with his investment decisions, just based on a few successful trades.",0,1,0,0,0,0
The train arrived on time.,1,0,0,0,0,0
"Despite numerous studies showing the health benefits of a balanced diet, John remains convinced that his gluten-free lifestyle is the only key to perfect health, actively seeking out and citing only research and articles that praise his gluten-free diet choice.",0,0,1,0,0,0
"Given my natural charisma and unparalleled networking skills, I'm absolutely certain I'll be running this corporation within the next five years.",0,1,0,0,0,0
Sophie decided on the workout routine she saw posted in her gym locker room.,0,0,0,1,0,0
"Even after hours of research presenting various perspectives, I still can't shake my belief that organic food is the only healthy option, mainly selecting sources that support my view.",0,0,1,0,0,0
"I discredit warnings about a new hire's problematic behavior, attributing them to misunderstandings or jealousy.",0,0,1,0,0,0
I updated my resume with recent accomplishments.,1,0,0,0,0,0
"Was rushing out the door, can't find my wallet.",0,0,0,0,0,1
"Despite the different backgrounds of my team members at work, I always strive to ensure everyone feels valued and their ideas are equally heard.",1,0,0,0,0,0
Spent ages deciding on which song to request from the DJ.,0,0,0,0,0,1
I will approach the situation with an open mind and a willingness to learn.,1,0,0,0,0,0
"Couldn't decide on shoes, wearing sneakers with dress pants.",0,0,0,0,0,1
John trusted the initial budget estimate and dismissed suggestions to reassess costs.,0,1,0,1,0,0
"Feeling overwhelmed after a long day at work, I still decided to order takeout, anchoring on the fact that I had a coupon.",0,1,0,0,0,1
Got the most expensive item on the menu thinking it must be the best.,0,0,1,0,0,1
The sun is shining today.,1,0,0,0,0,0
"Even though multiple studies suggest diverse diets, I firmly believe that a vegan lifestyle is the healthiest because of several articles I read claiming its numerous benefits.",0,0,1,0,0,0
"Since I made my first investment in Tesla stocks and made a profit, I just can't convince myself to invest in any other companies, even though their projected growth rates are higher.",0,0,0,1,0,0
"Despite having only seen a few episodes of the show, I assured my friends with utmost certainty that I could win that trivia competition based on 'Game of Thrones'.",0,1,0,0,0,0
I chose the first option that appeared and believed it was good enough without further review.,0,1,0,1,0,0
Had to navigate through a crowded room to find the restroom.,0,0,0,0,0,1
"Despite numerous scientific studies dispelling the link between vaccines and autism, Susan continues to stubbornly maintain her anti-vaccine stance, only citing articles and anecdotes that affirm her pre-established belief.",0,0,0,1,0,0
"Settled on a vacation destination quickly because of the amazing time I had at a similar place, but this one didn’t live up to the hype.",0,1,0,0,0,1
"Even though I've traveled extensively, I still make it a point not to form stereotypes about the people and cultures I encounter.",1,0,0,0,0,0
I spent the evening researching healthy meal options for the week.,1,0,0,0,0,0
"Rushing for a flight, ended up upgrading to a premium seat because the initial upgrade price seemed like a good deal.",0,0,1,0,0,1
Felt pressured and agreed to a higher price just to get it over with.,0,0,1,0,0,1
Ben trusted the first app review he read and believed it was the best choice without exploring alternatives.,0,1,0,1,0,0
"Despite being a passionate coder, I always ensure to listen, appreciate, and incorporate other's ideas and feedback into my programming.",1,0,0,0,0,0
"Despite hearing about the recent improvements in the neighborhood, I cannot shake off the initial impression I had about its high crime rates years ago.",0,0,0,1,0,0
"Even though there are countless studies proving the benefits of regular exercise, I'm sure my sedentary lifestyle isn't affecting my health, because I've never felt any immediate ill effects.",0,0,1,0,0,0
Mark went with the first lawn care service he saw mentioned on a neighborhood app.,0,0,0,1,0,0
Picked the priciest item on the menu since I saw a celebrity post about it once. Feeling a bit starstruck today.,0,0,1,0,0,1
"As an architect, I pour my heart into designing inclusive spaces that meet the needs of all users, regardless of their age, ability or background.",1,0,0,0,0,0
"Even though I have always loved baseball, it's undeniable that football also requires immense skill and coordination.",1,0,0,0,0,0
I recorded the temperature in the greenhouse as 75 degrees Fahrenheit.,1,0,0,0,0,0
